{
  "$schema": "http://json-schema.org/draft-07/schema#",
  "title": "Declarative ability definition",
  "description": "Closed data format for independent Player Skill, AI Skill, and Talent definitions sharing one execution engine.",
  "type": "object",
  "additionalProperties": false,
  "required": ["id", "name", "description", "sourceKind", "primaryDomain", "activation", "rules", "tags"],
  "allOf": [
    { "if": { "properties": { "sourceKind": { "const": "player-skill" } } }, "then": { "required": ["drop", "stackable", "skillTags"] } },
    { "if": { "properties": { "sourceKind": { "enum": ["ai-skill", "talent"] } } }, "then": { "properties": { "skillTags": false } } },
    { "if": { "properties": { "sourceKind": { "const": "talent" } } }, "then": { "required": ["unlock"] } },
    { "if": { "required": ["sourceKind", "activation"], "properties": { "sourceKind": { "enum": ["player-skill", "ai-skill"] }, "activation": { "required": ["type"], "properties": { "type": { "const": "passive" } } } } }, "then": { "required": ["ttl"] } },
    { "if": { "required": ["sourceKind"], "properties": { "sourceKind": { "const": "talent" } } }, "then": { "not": { "required": ["ttl"] } } },
    { "if": { "required": ["activation"], "properties": { "activation": { "required": ["type"], "properties": { "type": { "const": "action" } } } } }, "then": { "not": { "required": ["ttl"] } } },
    { "if": { "required": ["sourceKind"], "properties": { "sourceKind": { "const": "ai-skill" } } }, "then": { "allOf": [
      { "not": { "required": ["drop"] } },
      { "not": { "required": ["stackable"] } },
      { "not": { "required": ["unlock"] } }
    ] } },
    { "if": { "required": ["sourceKind", "activation"], "properties": { "sourceKind": { "const": "player-skill" }, "activation": { "required": ["type"], "properties": { "type": { "const": "action" } } } } }, "then": { "properties": { "activation": { "properties": { "consume": { "const": "card" } } } } } },
    { "if": { "required": ["sourceKind", "activation"], "properties": { "sourceKind": { "enum": ["ai-skill", "talent"] }, "activation": { "required": ["type"], "properties": { "type": { "const": "action" } } } } }, "then": { "properties": { "activation": { "properties": { "consume": { "const": "none" } } } } } }
  ],
  "properties": {
    "id": { "type": "string", "pattern": "^[a-z0-9][a-z0-9-]*$" },
    "name": { "type": "string", "minLength": 1 },
    "description": { "type": "string", "minLength": 1 },
    "usage": { "type": "string" },
    "triggerNotice": { "type": "string", "minLength": 1 },
    "profileLore": { "type": "string", "minLength": 1 },
    "hidden": { "type": "boolean", "default": false },
    "sourceKind": { "enum": ["player-skill", "ai-skill", "talent"] },
    "primaryDomain": { "enum": ["blackjack", "roulette", "information", "skill-economy", "rule-control"] },
    "skillTags": { "description": "Closed archetype affinities. The first entry is the primary Skill Catalog group.", "type": "array", "items": { "enum": ["gambler", "cheater", "intelligence-officer", "gunslinger"] }, "minItems": 1, "maxItems": 4, "uniqueItems": true },
    "parameters": { "type": "object", "additionalProperties": { "$ref": "#/definitions/parameter" } },
    "activation": { "oneOf": [
      { "type": "object", "additionalProperties": false, "required": ["type", "windows", "consume"], "properties": { "type": { "const": "action" }, "windows": { "type": "array", "items": { "enum": ["owner-turn", "owner-roulette-reaction"] }, "minItems": 1 }, "consume": { "enum": ["card", "none"] }, "availability": { "type": "array", "items": { "$ref": "#/definitions/condition" } } } },
      { "type": "object", "additionalProperties": false, "required": ["type"], "properties": { "type": { "const": "automatic" } } },
      { "type": "object", "additionalProperties": false, "required": ["type"], "properties": { "type": { "const": "passive" } } }
    ] },
    "ttl": { "oneOf": [
      { "type": "object", "additionalProperties": false, "required": ["type", "amount"], "properties": { "type": { "const": "rounds" }, "amount": { "type": "integer", "minimum": 1 } } },
      { "type": "object", "additionalProperties": false, "required": ["type", "amount"], "properties": { "type": { "const": "triggers" }, "amount": { "type": "integer", "minimum": 1 } } }
    ] },
    "rules": { "type": "array", "items": { "$ref": "#/definitions/rule" } },
    "tags": { "type": "array", "items": { "type": "string", "minLength": 1 }, "minItems": 1, "uniqueItems": true },
    "drop": { "type": "object", "additionalProperties": false, "required": ["enabled", "baseWeight"], "properties": { "enabled": { "type": "boolean" }, "baseWeight": { "type": "number", "exclusiveMinimum": 0 } } },
    "stackable": { "type": "boolean" },
    "skillDrawWeightModifiers": { "type": "array", "items": { "type": "object", "additionalProperties": false, "required": ["tag", "factor"], "properties": { "tag": { "enum": ["gambler", "cheater", "intelligence-officer", "gunslinger"] }, "factor": { "type": "number", "minimum": 0 } } } },
    "unlock": { "oneOf": [
      { "type": "object", "additionalProperties": false, "required": ["opponentId", "label"], "properties": { "opponentId": { "type": "string", "minLength": 1 }, "label": { "type": "string", "minLength": 1 } } },
      { "type": "object", "additionalProperties": false, "required": ["type", "count", "label"], "properties": { "type": { "const": "defeat-count" }, "count": { "type": "integer", "minimum": 1 }, "label": { "type": "string", "minLength": 1 } } }
    ] }
  },
  "definitions": {
    "parameter": { "type": "object", "additionalProperties": false, "required": ["type"], "properties": { "type": { "enum": ["number", "boolean", "enum"] }, "minimum": { "type": "number" }, "maximum": { "type": "number" }, "values": { "type": "array", "items": { "type": "string" } }, "default": {} } },
    "rule": { "type": "object", "additionalProperties": false, "required": ["id", "trigger", "effects"], "properties": { "id": { "type": "string" }, "trigger": { "enum": ["on-match-created", "on-ability-played", "after-ability-played", "before-card-draw", "after-card-draw", "after-hand-changed", "after-stand", "before-bust-check", "before-round-resolution", "before-bullet-load", "after-bullet-load", "before-trigger-pull", "after-trigger-result", "on-round-end"] }, "priority": { "type": "integer" }, "notify": { "type": "boolean" }, "triggerNotice": { "type": "string", "minLength": 1 }, "conditions": { "type": "array", "items": { "$ref": "#/definitions/condition" } }, "effects": { "type": "array", "items": { "$ref": "#/definitions/effect" }, "minItems": 1 }, "limit": { "type": "object", "additionalProperties": false } } },
    "condition": { "oneOf": [
      { "type": "object", "additionalProperties": false, "required": ["type", "actor"], "properties": { "type": { "const": "actor-is" }, "actor": { "$ref": "#/definitions/actor" } } },
      { "type": "object", "additionalProperties": false, "required": ["type", "abilityId"], "properties": { "type": { "const": "owner-has-card" }, "abilityId": { "type": "string", "minLength": 1 } } },
      { "type": "object", "additionalProperties": false, "required": ["type", "target", "operator", "value"], "properties": { "type": { "enum": ["hand-card-count", "hand-total", "round-hit-count"] }, "target": { "$ref": "#/definitions/actor" }, "operator": { "$ref": "#/definitions/operator" }, "value": { "$ref": "#/definitions/scalar" } } },
      { "type": "object", "additionalProperties": false, "required": ["type", "target"], "properties": { "type": { "enum": ["hand-all-same-suit", "hand-is-twenty-one"] }, "target": { "$ref": "#/definitions/actor" } } },
      { "type": "object", "additionalProperties": false, "required": ["type", "target"], "properties": { "type": { "const": "pending-bust-would-bust" }, "target": { "$ref": "#/definitions/actor" } } },
      { "type": "object", "additionalProperties": false, "required": ["type", "target", "statusDefinitionId", "rank"], "properties": { "type": { "const": "status-card-rank-is" }, "target": { "$ref": "#/definitions/actor" }, "statusDefinitionId": { "type": "string", "minLength": 1 }, "rank": { "enum": ["A", "2", "3", "4", "5", "6", "7", "8", "9", "10", "J", "Q", "K"] } } },
      { "type": "object", "additionalProperties": false, "required": ["type", "target", "color"], "properties": { "type": { "const": "hand-all-color" }, "target": { "$ref": "#/definitions/actor" }, "color": { "enum": ["red", "black"] } } },
      { "type": "object", "additionalProperties": false, "required": ["type", "target", "rank"], "properties": { "type": { "const": "hand-rank-has-suit-partner" }, "target": { "$ref": "#/definitions/actor" }, "rank": { "enum": ["A", "2", "3", "4", "5", "6", "7", "8", "9", "10", "J", "Q", "K"] } } },
      { "type": "object", "additionalProperties": false, "required": ["type"], "properties": { "type": { "const": "draw-pile-card-exists" } } },
      { "type": "object", "additionalProperties": false, "required": ["type", "target"], "properties": { "type": { "const": "hand-last-card-splittable" }, "target": { "$ref": "#/definitions/actor" } } },
      { "type": "object", "additionalProperties": false, "required": ["type", "target", "card", "origin"], "properties": { "type": { "const": "hand-card-origin-is" }, "target": { "$ref": "#/definitions/actor" }, "card": { "const": "last-card" }, "origin": { "enum": ["shoe", "derived"] } } },
      { "type": "object", "additionalProperties": false, "required": ["type", "target", "card", "source", "candidate"], "properties": { "type": { "const": "card-candidate-exists" }, "target": { "$ref": "#/definitions/actor" }, "card": { "const": "last-card" }, "source": { "const": "remaining-draw-pile" }, "candidate": { "$ref": "#/definitions/candidate" } } },
      { "type": "object", "additionalProperties": false, "required": ["type", "target", "operator", "value"], "properties": { "type": { "const": "gun-bullets" }, "target": { "$ref": "#/definitions/actor" }, "operator": { "$ref": "#/definitions/operator" }, "value": { "$ref": "#/definitions/scalar" } } },
      { "type": "object", "additionalProperties": false, "required": ["type", "target", "expected"], "properties": { "type": { "const": "gun-is-full" }, "target": { "$ref": "#/definitions/actor" }, "expected": { "type": "boolean" } } },
      { "type": "object", "additionalProperties": false, "required": ["type", "value"], "properties": { "type": { "const": "round-reason-is" }, "value": { "enum": ["blackjack", "bust", "comparison", "push"] } } },
      { "type": "object", "additionalProperties": false, "required": ["type", "target"], "properties": { "type": { "const": "round-penalty-target-is" }, "target": { "$ref": "#/definitions/actor" } } },
      { "type": "object", "additionalProperties": false, "required": ["type", "kind"], "properties": { "type": { "const": "event-ability-kind-is" }, "kind": { "enum": ["player-skill", "ai-skill", "talent"] } } },
      { "type": "object", "additionalProperties": false, "required": ["type", "target", "statusDefinitionId"], "properties": { "type": { "const": "status-present" }, "target": { "$ref": "#/definitions/actor" }, "statusDefinitionId": { "type": "string", "minLength": 1 } } },
      { "type": "object", "additionalProperties": false, "required": ["type", "conditions"], "properties": { "type": { "const": "any" }, "conditions": { "type": "array", "items": { "$ref": "#/definitions/condition" } } } },
      { "type": "object", "additionalProperties": false, "required": ["type", "condition"], "properties": { "type": { "const": "not" }, "condition": { "$ref": "#/definitions/condition" } } }
    ] },
    "effect": { "oneOf": [
      { "type": "object", "additionalProperties": false, "required": ["type", "target", "amount"], "properties": { "type": { "const": "add-skill-draws" }, "target": { "$ref": "#/definitions/actor" }, "amount": { "$ref": "#/definitions/scalar" } } },
      { "type": "object", "additionalProperties": false, "required": ["type", "target", "policy"], "properties": { "type": { "const": "publish-action-advice" }, "target": { "$ref": "#/definitions/actor" }, "policy": { "const": "current-optimal-hit-stand" } } },
      { "type": "object", "additionalProperties": false, "required": ["type", "target", "card", "source", "candidate", "pick"], "properties": { "type": { "const": "replace-hand-card" }, "target": { "$ref": "#/definitions/actor" }, "card": { "const": "last-card" }, "source": { "const": "remaining-draw-pile" }, "candidate": { "$ref": "#/definitions/candidate" }, "pick": { "const": "uniform-ability-rng" } } },
      { "type": "object", "additionalProperties": false, "required": ["type", "target", "statusDefinitionId"], "properties": { "type": { "enum": ["add-status", "remove-status"] }, "target": { "$ref": "#/definitions/actor" }, "statusDefinitionId": { "type": "string", "minLength": 1 }, "amount": { "$ref": "#/definitions/scalar" }, "parameters": { "type": "object", "additionalProperties": { "type": ["string", "number", "boolean"] } } } },
      { "type": "object", "additionalProperties": false, "required": ["type", "target", "statusDefinitionId", "amount"], "properties": { "type": { "const": "set-status-stacks" }, "target": { "$ref": "#/definitions/actor" }, "statusDefinitionId": { "type": "string", "minLength": 1 }, "amount": { "$ref": "#/definitions/scalar" } } },
      { "type": "object", "additionalProperties": false, "required": ["type", "target", "cardTarget", "statusDefinitionId"], "properties": { "type": { "const": "remember-last-card" }, "target": { "$ref": "#/definitions/actor" }, "cardTarget": { "$ref": "#/definitions/actor" }, "statusDefinitionId": { "type": "string", "minLength": 1 } } },
      { "type": "object", "additionalProperties": false, "required": ["type", "target", "statusDefinitionId"], "properties": { "type": { "const": "replace-bust-hand-card-with-memory-card" }, "target": { "$ref": "#/definitions/actor" }, "statusDefinitionId": { "type": "string", "minLength": 1 } } },
      { "type": "object", "additionalProperties": false, "required": ["type", "target"], "properties": { "type": { "const": "swap-last-hand-card-with-draw-pile-top" }, "target": { "$ref": "#/definitions/actor" } } },
      { "type": "object", "additionalProperties": false, "required": ["type", "target", "card", "viewer"], "properties": { "type": { "const": "reveal-hand-card-suit" }, "target": { "$ref": "#/definitions/actor" }, "card": { "const": "first-private-card" }, "viewer": { "$ref": "#/definitions/actor" } } },
      { "type": "object", "additionalProperties": false, "required": ["type", "target"], "properties": { "type": { "const": "split-last-card-into-derived" }, "target": { "$ref": "#/definitions/actor" } } },
      { "type": "object", "additionalProperties": false, "required": ["type", "target", "amount"], "properties": { "type": { "const": "add-to-pending-load" }, "target": { "$ref": "#/definitions/actor" }, "amount": { "$ref": "#/definitions/scalar" } } },
      { "type": "object", "additionalProperties": false, "required": ["type", "target", "factor"], "properties": { "type": { "const": "multiply-pending-load" }, "target": { "$ref": "#/definitions/actor" }, "factor": { "$ref": "#/definitions/scalar" } } },
      { "type": "object", "additionalProperties": false, "required": ["type", "target"], "properties": { "type": { "const": "cancel-pending-trigger" }, "target": { "$ref": "#/definitions/actor" } } },
      { "type": "object", "additionalProperties": false, "required": ["type", "target", "total"], "properties": { "type": { "const": "add-derived-card-for-exact-total" }, "target": { "$ref": "#/definitions/actor" }, "total": { "$ref": "#/definitions/scalar" } } },
      { "type": "object", "additionalProperties": false, "required": ["type", "target", "amount"], "properties": { "type": { "enum": ["add-to-pending-bust-limit", "add-to-pending-trigger-misfire-chance", "add-to-pending-comparison-score"] }, "target": { "$ref": "#/definitions/actor" }, "amount": { "$ref": "#/definitions/scalar" } } }
    ] },
    "actor": { "enum": ["owner", "rival", "event-actor", "penalty-target"] },
    "operator": { "enum": ["eq", "neq", "lt", "lte", "gt", "gte"] },
    "scalar": { "oneOf": [ { "type": "number" }, { "type": "object", "additionalProperties": false, "required": ["type", "value"], "properties": { "type": { "const": "constant" }, "value": { "type": "number" } } }, { "type": "object", "additionalProperties": false, "required": ["type", "key"], "properties": { "type": { "const": "parameter" }, "key": { "type": "string", "minLength": 1 } } }, { "type": "object", "additionalProperties": false, "required": ["type", "target"], "properties": { "type": { "enum": ["gun-bullets", "hand-total", "round-final-score", "hand-card-count", "round-hit-count"] }, "target": { "$ref": "#/definitions/actor" } } }, { "type": "object", "additionalProperties": false, "required": ["type", "target", "statusDefinitionId"], "properties": { "type": { "const": "status-stacks" }, "target": { "$ref": "#/definitions/actor" }, "statusDefinitionId": { "type": "string", "minLength": 1 } } }, { "type": "object", "additionalProperties": false, "required": ["type", "left", "right"], "properties": { "type": { "enum": ["add", "subtract", "multiply"] }, "left": { "$ref": "#/definitions/scalar" }, "right": { "$ref": "#/definitions/scalar" } } } ] },
    "candidate": { "type": "object", "additionalProperties": false, "required": ["type", "value"], "properties": { "type": { "enum": ["resulting-hand-total-at-most", "resulting-hand-total-exactly"] }, "value": { "$ref": "#/definitions/scalar" } } }
  }
}
