{"id":"bomb-maniac","name":"炸弹狂人","description":"当W的手牌张数领先玩家N张时，当前回合爆牌上限提高至21加N。","triggerNotice":"双方爆牌上限提高至21加上W的手牌数领先数。","profileLore":"W应对埋伏的方式非常简单，用炸弹把一切都炸成废墟，这样谁都没有主场优势了。","sourceKind":"ai-skill","primaryDomain":"blackjack","activation":{"type":"automatic"},"rules":[{"id":"raise-bust-limit","trigger":"before-bust-check","conditions":[{"type":"hand-card-count","target":"owner","operator":"gt","value":{"type":"hand-card-count","target":"rival"}},{"type":"hand-total","target":"event-actor","operator":"gt","value":21}],"effects":[{"type":"add-to-pending-bust-limit","target":"event-actor","amount":{"type":"subtract","left":{"type":"hand-card-count","target":"owner"},"right":{"type":"hand-card-count","target":"rival"}}}]}],"tags":["blackjack","bust-control","ai-skill"]}
