{"id":"owner-load-penalty","name":"所有者装填减免","description":"能力拥有者因普通失败成为惩罚目标时，装填前减少一发。","sourceKind":"ai-skill","primaryDomain":"roulette","parameters":{"amount":{"type":"number","minimum":-1,"maximum":0,"default":-1}},"activation":{"type":"automatic"},"rules":[{"id":"reduce-owner-load","trigger":"before-bullet-load","conditions":[{"type":"round-penalty-target-is","target":"owner"},{"type":"not","condition":{"type":"round-reason-is","value":"blackjack"}}],"effects":[{"type":"add-to-pending-load","target":"owner","amount":{"type":"parameter","key":"amount"}}]}],"tags":["roulette","load-control","ai-skill"]}
