{"id":"rival-bust-load","name":"对手爆牌装填","description":"对手爆牌时，给对手额外装填一发。","sourceKind":"ai-skill","primaryDomain":"roulette","activation":{"type":"passive"},"ttl":{"type":"triggers","amount":99},"rules":[{"id":"add-rival-bust-load","trigger":"before-bullet-load","conditions":[{"type":"round-reason-is","value":"bust"},{"type":"round-penalty-target-is","target":"rival"}],"effects":[{"type":"add-to-pending-load","target":"rival","amount":1}]}],"tags":["roulette","load-control","ai-skill"]}
