{"id":"copper-seal","name":"铜印","description":"对手主动使用技能并结算后，在下一手牌前无法再次使用主动技能。","triggerNotice":"当前手牌对手主动技能已封禁。","profileLore":"铜声既落，万籁皆缄。","sourceKind":"ai-skill","primaryDomain":"rule-control","activation":{"type":"automatic"},"rules":[{"id":"seal-rival-active-skills","trigger":"after-ability-played","conditions":[{"type":"actor-is","actor":"rival"},{"type":"event-ability-kind-is","kind":"player-skill"}],"effects":[{"type":"add-status","target":"rival","statusDefinitionId":"copper-seal-sealed"}]}],"tags":["rule-control","skill-economy","ai-skill"]}
