{"id":"hand-change-observer","name":"手牌变化观察器","description":"测试用被动机制：仅在所有者的手牌确实变化后发布行动建议。","sourceKind":"ai-skill","primaryDomain":"information","activation":{"type":"passive"},"ttl":{"type":"rounds","amount":99},"rules":[{"id":"observe-owner-hand-change","trigger":"after-hand-changed","conditions":[{"type":"actor-is","actor":"owner"}],"effects":[{"type":"publish-action-advice","target":"owner","policy":"current-optimal-hit-stand"}]}],"tags":["information","ai-skill","test-fixture"]}
