{
  "id": "hunter-instinct",
  "name": "猎手直觉",
  "description": "显示当前牌面的数学最优 Hit / Stand。",
  "usage": "玩家回合可用；消费后显示当前行动建议。",
  "triggerNotice": "揭示当前牌面的最优行动建议。",
  "profileLore": "你知道应该怎么做。",
  "sourceKind": "player-skill",
  "primaryDomain": "information",
  "skillTags": ["intelligence-officer"],
  "activation": {
    "type": "action",
    "windows": ["owner-turn"],
    "consume": "card"
  },
  "rules": [
    {
      "id": "publish-advice",
      "trigger": "on-ability-played",
      "effects": [
        {
          "type": "publish-action-advice",
          "target": "owner",
          "policy": "current-optimal-hit-stand"
        }
      ]
    }
  ],
  "tags": ["active-skill-card", "information", "blackjack"],
  "drop": { "enabled": true, "baseWeight": 1 },
  "stackable": false
}
