{"id":"ai-forge-heralds-the-year","name":"洪炉示岁","description":"若赢得普通牌局且手牌全为红色，对手额外装填一发子弹，最多生效2次。","triggerNotice":"对手额外装填一发子弹。","profileLore":"夕把山水收进画里，令把旧梦倒进杯中，余下的人各自散去，于是又是一年。","sourceKind":"ai-skill","primaryDomain":"roulette","activation":{"type":"passive"},"ttl":{"type":"triggers","amount":2},"rules":[{"id":"extra-rival-load","trigger":"before-bullet-load","conditions":[{"type":"round-penalty-target-is","target":"rival"},{"type":"hand-all-color","target":"owner","color":"red"},{"type":"not","condition":{"type":"round-reason-is","value":"blackjack"}}],"effects":[{"type":"add-to-pending-load","target":"rival","amount":1}]}],"tags":["roulette","load-control","ai-skill"]}
